{
  "$schema": "http://json-schema.org/draft-07/schema#",
  "title": "actual-capabilities IR",
  "description": "后端已经有的操作。来自 OpenAPI 或代码时，每条都必须带 sources。",
  "type": "object",
  "additionalProperties": false,
  "required": ["version", "generatedAt", "generator", "operations"],
  "properties": {
    "version": { "const": "1" },
    "generatedAt": { "type": "string", "minLength": 1 },
    "generator": { "type": "string", "minLength": 1 },
    "operations": {
      "type": "array",
      "items": { "$ref": "#/definitions/operation" }
    }
  },
  "definitions": {
    "source": {
      "type": "object",
      "additionalProperties": false,
      "required": ["file", "lineStart"],
      "properties": {
        "file": { "type": "string", "minLength": 1 },
        "lineStart": { "type": "integer", "minimum": 1 },
        "lineEnd": { "type": "integer", "minimum": 1 },
        "symbol": { "type": "string", "minLength": 1 }
      }
    },
    "operation": {
      "type": "object",
      "additionalProperties": false,
      "required": ["id", "method", "path", "sources", "response"],
      "properties": {
        "id": { "type": "string", "minLength": 1 },
        "method": { "enum": ["GET", "POST", "PUT", "PATCH", "DELETE", "HEAD", "OPTIONS"] },
        "path": { "type": "string", "pattern": "^/" },
        "summary": { "type": "string" },
        "sources": {
          "type": "array",
          "minItems": 1,
          "items": { "$ref": "#/definitions/source" }
        },
        "response": {
          "type": "object",
          "additionalProperties": false,
          "required": ["fields"],
          "properties": {
            "fields": {
              "type": "array",
              "items": { "type": "string", "minLength": 1 }
            }
          }
        }
      }
    }
  }
}
